{
  "protocol": "onetool.console",
  "protocol_version": 1,
  "instance_id": "mcp-alpha",
  "batch_id": "batch-alpha",
  "cursor": 0,
  "next_cursor": 2,
  "oldest_retained": 1,
  "has_more": false,
  "events": [
    {
      "protocol": "onetool.console",
      "protocol_version": 1,
      "id": "evt-snapshot",
      "instance_id": "mcp-alpha",
      "sequence": 1,
      "type": "instance.snapshot",
      "created_at": "2026-06-07T00:00:01Z",
      "payload": {
        "id": "mcp-alpha",
        "cwd": "/Users/gavin/project",
        "repo_root": "/Users/gavin/project",
        "config_path": "/Users/gavin/.onetool/onetool.yaml",
        "config_dir": "/Users/gavin/.onetool",
        "allowed_roots": ["/Users/gavin/project"],
        "status": "running",
        "message_count": 1,
        "started_at": "2026-06-07T00:00:00Z",
        "updated_at": "2026-06-07T00:00:01Z",
        "runtime": { "name": "onetool-mcp" }
      }
    },
    {
      "protocol": "onetool.console",
      "protocol_version": 1,
      "id": "evt-display",
      "instance_id": "mcp-alpha",
      "sequence": 2,
      "type": "console.message.created",
      "created_at": "2026-06-07T00:00:02Z",
      "payload": {
        "id": "abc123def456",
        "kind": "markdown",
        "metadata": { "title": "Run summary" },
        "created_at": "2026-06-07T00:00:00Z",
        "updated_at": "2026-06-07T00:00:00Z",
        "payload": {
          "mode": "inline",
          "mime_type": "text/markdown",
          "size_bytes": 18,
          "language": "markdown",
          "content": "# Result\n\n- passed"
        },
        "preview": {
          "text": "# Result\n\n- passed",
          "truncated": false,
          "size_bytes": 18,
          "limit_bytes": 65536
        }
      }
    }
  ],
  "created_at": "2026-06-07T00:00:03Z"
}

